id,feedback,aspects,aspect_sentiments,source_channel
1762,omg actually impressed for once. the esim activation took literally 10 minutes through the app. network connected instantly and 5g speeds kicked in immediately. didnt expect this level of efficiency from them,"[""sim_activation"", ""mobile_app_experience"", ""5g_experience""]","{""sim_activation"": ""positive"", ""mobile_app_experience"": ""positive"", ""5g_experience"": ""positive""}",twitter
1763,Absolutely love how the billing surprises me with creative new charges every month. It is like a subscription box where I never know what mysterious fees will appear next. Keeps things exciting. The customer support team is equally creative in their excuses.,"[""billing"", ""customer_support""]","{""billing"": ""negative"", ""customer_support"": ""negative""}",complaint_ticket
1764,Roaming. It happened. I survived.,"[""roaming""]","{""roaming"": ""neutral""}",survey
1765,Strong network coverage in my residential area with zero dead zones even in the basement parking. Call quality is excellent for both voice and video calls. The data balance consumption is predictable and matches my actual usage. Reliable carrier overall.,"[""network_coverage"", ""call_quality"", ""data_balance""]","{""network_coverage"": ""positive"", ""call_quality"": ""positive"", ""data_balance"": ""positive""}",survey
1766,plz do something about the data validity. 24 days is ridiculous. other carriers give 28 minimum. and the ott bundle quality is pathetic. mobile only 480p streaming in 2024. embarrassing,"[""data_validity"", ""ott_bundle_services""]","{""data_validity"": ""negative"", ""ott_bundle_services"": ""negative""}",customer_care_chat
1767,I would write a detailed review but the internet speed is so slow that this page might time out before I finish typing. Let me just say that the experience matches the low expectations I had coming in. The network coverage is equally inspiring.,"[""internet_speed"", ""network_coverage""]","{""internet_speed"": ""negative"", ""network_coverage"": ""negative""}",app_review
1768,Billing okay. Plan okay. Life goes on.,"[""billing"", ""recharge_plans""]","{""billing"": ""neutral"", ""recharge_plans"": ""neutral""}",survey
1769,"The value for money on the premium plan is genuinely impressive. Internet speed is consistently fast, 5G coverage works in most areas I visit, and the included OTT bundle gives me access to five streaming platforms. All this at a price that is competitive with lower-tier plans from others.","[""value_for_money"", ""internet_speed"", ""5g_experience"", ""ott_bundle_services"", ""pricing""]","{""value_for_money"": ""positive"", ""internet_speed"": ""positive"", ""5g_experience"": ""positive"", ""ott_bundle_services"": ""positive"", ""pricing"": ""positive""}",app_review
1770,Sure. Why not. It is a telecom service.,"[""network_coverage""]","{""network_coverage"": ""neutral""}",survey
1771,What a privilege to experience their roaming service where my phone becomes an expensive paperweight the moment I cross the border. Despite activating everything correctly through the app nothing worked abroad. Came home to a bill that suggests otherwise. Magic.,"[""roaming"", ""mobile_app_experience"", ""billing""]","{""roaming"": ""negative"", ""mobile_app_experience"": ""negative"", ""billing"": ""negative""}",complaint_ticket
1772,Sim activated. Phone works. Done.,"[""sim_activation""]","{""sim_activation"": ""positive""}",customer_care_chat
1773,The quarterly recharge plan at 699 is solid value for money with 84 days validity and 2GB daily data. OTT access includes three platforms and the billing is straightforward with no hidden charges. Data balance tracking in the app is accurate. Reliable overall.,"[""recharge_plans"", ""value_for_money"", ""data_validity"", ""ott_bundle_services"", ""billing"", ""data_balance"", ""mobile_app_experience""]","{""recharge_plans"": ""positive"", ""value_for_money"": ""positive"", ""data_validity"": ""positive"", ""ott_bundle_services"": ""positive"", ""billing"": ""positive"", ""data_balance"": ""positive"", ""mobile_app_experience"": ""positive""}",app_review
1774,I have opinions. They are neutral.,"[""network_coverage""]","{""network_coverage"": ""neutral""}",survey
1775,ur 5g is basically 4g with a new label. same speeds same coverage same everything. just marketing fluff. the only thing that changed is the pricing went up. value for money is a joke at this point,"[""5g_experience"", ""internet_speed"", ""network_coverage"", ""pricing"", ""value_for_money""]","{""5g_experience"": ""negative"", ""internet_speed"": ""negative"", ""network_coverage"": ""negative"", ""pricing"": ""negative"", ""value_for_money"": ""negative""}",twitter
1776,The network coverage in rural Maharashtra has genuinely surprised me in a positive way. Full signal even in remote villages where other carriers show no service. Call quality is clear and internet speed is usable for video calls which is all I need when visiting family.,"[""network_coverage"", ""call_quality"", ""internet_speed""]","{""network_coverage"": ""positive"", ""call_quality"": ""positive"", ""internet_speed"": ""positive""}",survey
1777,Standard fare. Nothing remarkable.,"[""recharge_plans""]","{""recharge_plans"": ""neutral""}",survey
1778,How convenient that the data balance notification arrives exactly one minute after my data is fully exhausted. Timely alerts are clearly not in their vocabulary. The mobile app shows remaining balance but refreshes once every 6 hours which is essentially useless for real-time tracking.,"[""data_balance"", ""mobile_app_experience""]","{""data_balance"": ""negative"", ""mobile_app_experience"": ""negative""}",app_review
1779,Adequate for basic needs.,"[""internet_speed""]","{""internet_speed"": ""neutral""}",customer_care_chat
1780,Really satisfied with customer support on the priority line. Zero wait time and the agent resolved my internet speed complaint within one call by escalating to technical team. Got a callback same day confirming the fix. This is how support should work everywhere.,"[""customer_support"", ""internet_speed""]","{""customer_support"": ""positive"", ""internet_speed"": ""positive""}",customer_care_chat
1781,The pricing makes me laugh. Not in a good way.,"[""pricing""]","{""pricing"": ""negative""}",twitter
1782,intrenet so slow my patience runs out before the page loads. cant even stream at lowest quality without buffering every 10 seconds. this is what they call 4g in 2024. prblm is nobody at the company cares enough to fix it,"[""internet_speed"", ""customer_support""]","{""internet_speed"": ""negative"", ""customer_support"": ""negative""}",complaint_ticket
1783,The irony of their customer support line dropping calls while you are trying to report call quality issues is not lost on me. It is like calling the fire department and having the phone catch fire. Poetic really. At least it gives you perspective.,"[""customer_support"", ""call_quality""]","{""customer_support"": ""negative"", ""call_quality"": ""negative""}",twitter
1784,Manageable. Gets me through the day.,"[""network_coverage"", ""internet_speed""]","{""network_coverage"": ""neutral"", ""internet_speed"": ""neutral""}",survey
1785,"Impressed with how well the roaming worked across four European countries. Automatic network switching, good data speeds for maps and messaging, and clear call quality throughout. The daily pack pricing was reasonable and billing afterward showed exactly what was promised.","[""roaming"", ""internet_speed"", ""call_quality"", ""pricing"", ""billing""]","{""roaming"": ""positive"", ""internet_speed"": ""positive"", ""call_quality"": ""positive"", ""pricing"": ""positive"", ""billing"": ""positive""}",survey
1786,It is a SIM card. It lives in my phone.,"[""sim_activation""]","{""sim_activation"": ""neutral""}",survey
1787,cant blv the recharge plan got worse again. same 299 plan now gives 1.5gb instead of 2gb. data validity also cut from 28 to 24 days. and they wonder why people switch. omg worst value ever,"[""recharge_plans"", ""data_validity"", ""value_for_money""]","{""recharge_plans"": ""negative"", ""data_validity"": ""negative"", ""value_for_money"": ""negative""}",twitter
1788,Good call quality on this network. Voice is clear on both regular calls and VoLTE. Network coverage in my city is comprehensive with no dead zones that I have found in six months of use. A reliable experience that I do not have to think about.,"[""call_quality"", ""network_coverage""]","{""call_quality"": ""positive"", ""network_coverage"": ""positive""}",survey
1789,No strong feelings. It is a phone plan.,"[""recharge_plans"", ""value_for_money""]","{""recharge_plans"": ""neutral"", ""value_for_money"": ""neutral""}",survey
1790,Thank you for the incredible value of paying 599 rupees monthly to watch Netflix in the resolution of a security camera from 2005. The OTT bundle truly represents the pinnacle of what modern money can buy. My eyes have never been more relaxed than when squinting at 480p.,"[""ott_bundle_services"", ""pricing"", ""value_for_money""]","{""ott_bundle_services"": ""negative"", ""pricing"": ""negative"", ""value_for_money"": ""negative""}",app_review
1791,Fine I guess.,"[""mobile_app_experience""]","{""mobile_app_experience"": ""neutral""}",app_review
1792,The sim activation for my elderly mother went smoothly thanks to patient customer support staff at the store. They helped with the video KYC process and made sure the recharge plan suited her light usage needs. She was making calls within an hour of visiting.,"[""sim_activation"", ""customer_support"", ""recharge_plans"", ""call_quality""]","{""sim_activation"": ""positive"", ""customer_support"": ""positive"", ""recharge_plans"": ""positive"", ""call_quality"": ""positive""}",customer_care_chat
1793,Okay.,"[""billing""]","{""billing"": ""neutral""}",survey
1794,v bad experience with sim activation. took 6 days when they promised 24 hours. then the network coverage in my area turned out to be garbage. no signal inside my house. plz at least show accurate coverage maps before selling,"[""sim_activation"", ""network_coverage""]","{""sim_activation"": ""negative"", ""network_coverage"": ""negative""}",complaint_ticket
1795,The 5G experience at the airport was genuinely impressive. Downloaded a 2GB movie in under 30 seconds before boarding. Network coverage was flawless throughout the terminal and call quality for my last-minute work call was crystal clear. Technology working as intended.,"[""5g_experience"", ""internet_speed"", ""network_coverage"", ""call_quality""]","{""5g_experience"": ""positive"", ""internet_speed"": ""positive"", ""network_coverage"": ""positive"", ""call_quality"": ""positive""}",app_review
1796,Data validity. Exists. Expires. Repeat.,"[""data_validity""]","{""data_validity"": ""neutral""}",survey
1797,I find it charming that the mobile app has a speed test feature built in that consistently shows 150 Mbps while actual browsing feels like dial-up internet. The cognitive dissonance is impressive. At least the recharge flow works without crashing most of the time.,"[""mobile_app_experience"", ""internet_speed"", ""recharge_plans""]","{""mobile_app_experience"": ""negative"", ""internet_speed"": ""negative"", ""recharge_plans"": ""neutral""}",app_review
1798,Standard. No complaints but no praise either.,"[""network_coverage"", ""call_quality""]","{""network_coverage"": ""neutral"", ""call_quality"": ""neutral""}",survey
1799,Really good value for money on the family plan. Four connections sharing a pool of data with individual OTT access for each member. Billing is consolidated and clear. Customer support helped set it all up quickly. Overall a positive experience worth recommending.,"[""value_for_money"", ""recharge_plans"", ""ott_bundle_services"", ""billing"", ""customer_support""]","{""value_for_money"": ""positive"", ""recharge_plans"": ""positive"", ""ott_bundle_services"": ""positive"", ""billing"": ""positive"", ""customer_support"": ""positive""}",customer_care_chat
1800,"I have been facing persistent network coverage issues in my residential area for over two months now. Despite raising three separate complaint tickets and speaking with customer support each time, there has been zero improvement. Calls drop constantly and the internet speed is unusable during evening hours when everyone in the colony is online.","[""network_coverage"", ""customer_support"", ""call_quality"", ""internet_speed""]","{""network_coverage"": ""negative"", ""customer_support"": ""negative"", ""call_quality"": ""negative"", ""internet_speed"": ""negative""}",complaint_ticket
1801,The billing department has overcharged me for three consecutive months and each time I call customer support they promise a credit that never materializes on my next statement. I have spent cumulative hours on hold waiting for agents who ultimately cannot resolve a simple billing error. This level of incompetence is staggering for a major carrier.,"[""billing"", ""customer_support""]","{""billing"": ""negative"", ""customer_support"": ""negative""}",complaint_ticket
1802,"After switching to this carrier last month the overall experience has been average. The internet speed is adequate for most tasks, the network coverage is present in areas where my previous provider struggled, and the recharge plan pricing is in line with what competitors charge in the market.","[""internet_speed"", ""network_coverage"", ""recharge_plans"", ""pricing""]","{""internet_speed"": ""neutral"", ""network_coverage"": ""neutral"", ""recharge_plans"": ""neutral"", ""pricing"": ""neutral""}",app_review
1803,plz fix the intrenet speed in my area. been suffering for weeks with barely 2mbps on a plan that promises 50mbps. raised complaint multiple times but custmer care just keeps saying they r working on it. no actual resolution provided ever. very frustrating experience,"[""internet_speed"", ""customer_support""]","{""internet_speed"": ""negative"", ""customer_support"": ""negative""}",customer_care_chat
1804,The 5G experience in my city has exceeded all expectations. I consistently get download speeds above 700 Mbps and the latency is low enough for competitive online gaming. The network coverage for 5G extends across most areas I visit daily and the value for money on the premium plan is justified by this performance.,"[""5g_experience"", ""internet_speed"", ""network_coverage"", ""value_for_money""]","{""5g_experience"": ""positive"", ""internet_speed"": ""positive"", ""network_coverage"": ""positive"", ""value_for_money"": ""positive""}",app_review
1805,omg worst experience with sim activation ever. submitted documents a week ago and the status still shows processing. called custmer support 4 times and each agent gives me a different timeline. one said 24 hrs another said 5 days. nobody actually knows whats happening with my application,"[""sim_activation"", ""customer_support""]","{""sim_activation"": ""negative"", ""customer_support"": ""negative""}",complaint_ticket
1806,I want to express my genuine satisfaction with the customer support team who handled my complex roaming issue yesterday. The agent stayed on the line for thirty minutes patiently resolving a billing dispute from my international trip. She also proactively suggested a better roaming pack for my upcoming travel. Exemplary service.,"[""customer_support"", ""roaming"", ""billing""]","{""customer_support"": ""positive"", ""roaming"": ""positive"", ""billing"": ""positive""}",customer_care_chat
1807,The data balance on my account has been draining at an alarming rate that does not correspond with my actual usage patterns. I have monitored my phone carefully and background data is restricted yet the balance depletes twice as fast as it should. Customer support dismisses my concern every time I raise it.,"[""data_balance"", ""customer_support""]","{""data_balance"": ""negative"", ""customer_support"": ""negative""}",complaint_ticket
1808,"I have been evaluating the value for money on my current recharge plan and it is acceptable for what I receive. The internet speed is adequate for basic needs, the OTT bundle covers mainstream platforms, and the data validity of 84 days is a standard offering. Nothing stands out positively or negatively.","[""value_for_money"", ""recharge_plans"", ""internet_speed"", ""ott_bundle_services"", ""data_validity""]","{""value_for_money"": ""neutral"", ""recharge_plans"": ""neutral"", ""internet_speed"": ""neutral"", ""ott_bundle_services"": ""neutral"", ""data_validity"": ""neutral""}",survey
1809,Pleasantly surprised by the call quality improvement in my neighborhood since last month. Previously every call had static and drops but now conversations are crystal clear throughout. Network coverage bars show full and actual performance matches. Whatever tower maintenance they did has made a massive difference.,"[""call_quality"", ""network_coverage""]","{""call_quality"": ""positive"", ""network_coverage"": ""positive""}",complaint_ticket
1810,The mobile app experience is functional since the last update. Previously it would crash during recharges but that is fixed now. The data balance display works and the plan comparison feature exists. It does what it needs to do without being particularly impressive or problematic.,"[""mobile_app_experience"", ""recharge_plans"", ""data_balance""]","{""mobile_app_experience"": ""neutral"", ""recharge_plans"": ""neutral"", ""data_balance"": ""neutral""}",app_review
1811,I purchased the international roaming pack for my business trip to Europe but it simply did not activate upon landing despite multiple attempts through the app. Spent two days abroad without any connectivity until I found WiFi to contact customer support who said it was a provisioning error. Completely unacceptable.,"[""roaming"", ""mobile_app_experience"", ""customer_support""]","{""roaming"": ""negative"", ""mobile_app_experience"": ""negative"", ""customer_support"": ""negative""}",complaint_ticket
1812,"After comparing with three other carriers I can say this network offers a standard balance of pricing, internet speed, and network coverage for users in my metro city. The recharge plan at 599 provides average benefits and the billing process functions as expected without issues.","[""pricing"", ""internet_speed"", ""network_coverage"", ""recharge_plans"", ""billing""]","{""pricing"": ""neutral"", ""internet_speed"": ""neutral"", ""network_coverage"": ""neutral"", ""recharge_plans"": ""neutral"", ""billing"": ""neutral""}",survey
1813,v bad experience with the reacharg plans lately. they keep reducing data allocation while maintaining the same price. my 299 plan used to give 2gb daily now its only 1.5gb. data validity also shortened from 28 to 24 days. how is this acceptable. zero value for money anymore,"[""recharge_plans"", ""pricing"", ""data_validity"", ""value_for_money""]","{""recharge_plans"": ""negative"", ""pricing"": ""negative"", ""data_validity"": ""negative"", ""value_for_money"": ""negative""}",twitter
1814,The network coverage and call quality in my rural area have been consistent over the past six months. I get reception inside my house and calls go through without issues. Not dramatically better than before but functional and reliable for my daily needs in this location.,"[""network_coverage"", ""call_quality""]","{""network_coverage"": ""neutral"", ""call_quality"": ""neutral""}",survey
1815,ngl disappointed with the OTT bundle that comes with my recharge plan. They advertise Netflix and Prime but what you actually get is the lowest mobile-only tier with 480p streaming. For a plan costing 599 rupees I expected at least HD quality. Feels like false advertising to attract customers.,"[""ott_bundle_services"", ""recharge_plans"", ""pricing""]","{""ott_bundle_services"": ""negative"", ""recharge_plans"": ""negative"", ""pricing"": ""negative""}",app_review
1816,"The customer support experience on the priority line has been consistently excellent throughout my two years as a premium subscriber. Agents are knowledgeable, wait times are minimal, and issues get resolved on the first call. This alone justifies the higher pricing of the premium plan for me.","[""customer_support"", ""pricing"", ""recharge_plans""]","{""customer_support"": ""positive"", ""pricing"": ""positive"", ""recharge_plans"": ""positive""}",survey
1817,The internet speed on this carrier has been embarrassingly slow for the entire quarter in my locality. Multiple neighbors confirm the same issue suggesting it is a tower or infrastructure problem rather than individual device issues. We have collectively written to the company but received only template responses with no action.,"[""internet_speed"", ""network_coverage"", ""customer_support""]","{""internet_speed"": ""negative"", ""network_coverage"": ""negative"", ""customer_support"": ""negative""}",complaint_ticket
1818,"I am thoroughly impressed with the eSIM activation process they have implemented. Scanned the QR code, completed video KYC in three minutes, and had 5G connectivity within fifteen minutes of starting. The mobile app guided me through every step clearly. This is what digital onboarding should look like.","[""sim_activation"", ""5g_experience"", ""mobile_app_experience""]","{""sim_activation"": ""positive"", ""5g_experience"": ""positive"", ""mobile_app_experience"": ""positive""}",app_review
1819,The pricing structure on their recharge plans has become increasingly predatory. Every quarter they reduce benefits while maintaining or increasing prices. The data validity keeps shrinking and the value for money has completely eroded compared to when I first joined two years ago. Loyalty means nothing here.,"[""pricing"", ""recharge_plans"", ""data_validity"", ""value_for_money""]","{""pricing"": ""negative"", ""recharge_plans"": ""negative"", ""data_validity"": ""negative"", ""value_for_money"": ""negative""}",complaint_ticket
1820,"The billing system on this carrier has been consistent throughout my three years of service. Every charge is itemized, there are no unexpected fees, and the auto-debit works every cycle. Standard process that functions as expected without any notable issues or surprises.","[""billing""]","{""billing"": ""neutral""}",survey
1821,prblm with my data balance is that it drains overnight even when my phone is on airplane mode. how is that possible. i tracked it for a week and every morning 200-300mb is gone without any usage. custmer care says its system updates but i disabled all auto updates. clearly a system error on their end,"[""data_balance"", ""customer_support""]","{""data_balance"": ""negative"", ""customer_support"": ""negative""}",complaint_ticket
1822,"The combination of fast 5G internet speed, comprehensive OTT bundle, and competitive pricing on the 799 plan makes this carrier my top choice. I stream in 4K daily without buffering and the data allocation is generous enough that I never worry about running out before the validity period ends.","[""5g_experience"", ""internet_speed"", ""ott_bundle_services"", ""pricing"", ""recharge_plans""]","{""5g_experience"": ""positive"", ""internet_speed"": ""positive"", ""ott_bundle_services"": ""positive"", ""pricing"": ""positive"", ""recharge_plans"": ""positive""}",app_review
1823,The roaming service was a complete disaster during my recent trip to Southeast Asia. Despite activating the international pack three days before departure the service never connected to partner networks abroad. Customer support suggested manually selecting networks which did not work either. Ended up buying a local SIM.,"[""roaming"", ""customer_support""]","{""roaming"": ""negative"", ""customer_support"": ""negative""}",complaint_ticket
1824,Since moving to the new city the network coverage here is adequate. Signal strength is present in most areas including underground metro stations. Call quality is clear and internet speed is consistent throughout the day. Standard connectivity experience for a metro city.,"[""network_coverage"", ""call_quality"", ""internet_speed""]","{""network_coverage"": ""neutral"", ""call_quality"": ""neutral"", ""internet_speed"": ""neutral""}",survey
1825,tbh ok experience with the carrier overall but the data validity issue really bothers me. paying the same amount every month but now getting 4 fewer days of service compared to last year. combined with reduced data per day it means significantly less total data for identical pricing. not happy about that trend,"[""data_validity"", ""pricing"", ""value_for_money""]","{""data_validity"": ""negative"", ""pricing"": ""negative"", ""value_for_money"": ""negative""}",twitter
1826,"The annual recharge plan has been outstanding value for my family. At 2999 rupees for 365 days we get generous daily data, unlimited calls, and full OTT access. The billing is just once a year which eliminates monthly recharge hassle. For households on a budget this is the most economical option available.","[""recharge_plans"", ""value_for_money"", ""billing"", ""ott_bundle_services""]","{""recharge_plans"": ""positive"", ""value_for_money"": ""positive"", ""billing"": ""positive"", ""ott_bundle_services"": ""positive""}",app_review
1827,"ur mobile app is completely broken on ios. crashes when i try to reacharg, shows wrong data balance, and the ott bundle activation links lead to error pages. been like this for 2 weeks since the last update. plz fix this immediately. i shouldnt have to use the website for basic account management","[""mobile_app_experience"", ""recharge_plans"", ""data_balance"", ""ott_bundle_services""]","{""mobile_app_experience"": ""negative"", ""recharge_plans"": ""negative"", ""data_balance"": ""negative"", ""ott_bundle_services"": ""negative""}",app_review
