id,feedback,aspects,aspect_sentiments,source_channel
1000,The 5G experience in my city has been phenomenal. I consistently get speeds above 800 Mbps and streaming is buttery smooth. Definitely worth upgrading my plan for this kind of performance.,"[""5g_experience"", ""internet_speed""]","{""5g_experience"": ""positive"", ""internet_speed"": ""positive""}",app_review
1001,Network coverage is terrible in rural areas near my village. Calls keep dropping every few minutes.,"[""network_coverage"", ""call_quality""]","{""network_coverage"": ""negative"", ""call_quality"": ""negative""}",complaint_ticket
1002,plz fix ur network coverage in downtown. cant even make a call without it dropping. v bad experience tbh,"[""network_coverage"", ""call_quality""]","{""network_coverage"": ""negative"", ""call_quality"": ""negative""}",twitter
1003,Call quality on this network is okay. Nothing special.,"[""call_quality""]","{""call_quality"": ""neutral""}",survey
1004,5G speeds are decent in the metro area but the coverage doesn't extend to the suburbs at all. I expected better rollout by now given all the marketing hype. Customer support was helpful when I raised a complaint though.,"[""5g_experience"", ""network_coverage"", ""customer_support""]","{""5g_experience"": ""neutral"", ""network_coverage"": ""negative"", ""customer_support"": ""positive""}",app_review
1005,No signal in my office building. Frustrating.,"[""network_coverage""]","{""network_coverage"": ""negative""}",twitter
1006,Switched to this carrier for 5G and I am not disappointed. Calls are clear and the internet speed during peak hours is still fantastic. Best decision I made this year for my mobile experience.,"[""5g_experience"", ""call_quality"", ""internet_speed""]","{""5g_experience"": ""positive"", ""call_quality"": ""positive"", ""internet_speed"": ""positive""}",survey
1007,I am really disappointed with the call quality lately. Keeps breaking up during important calls.,"[""call_quality""]","{""call_quality"": ""negative""}",twitter
1008,Network coverage is fine in the city for the most part. Nothing special or outstanding but it works reliably enough for daily calls and browsing. I rarely face complete dead zones in the urban areas but the speeds and signal strength are never exceptionally impressive either. It is just an average middle ground experience.,"[""network_coverage""]","{""network_coverage"": ""neutral""}",survey
1009,The intrenet speed on 5G is amazng. I download movies in seconds now. Totally worth the extra cost for the premium plan.,"[""internet_speed"", ""5g_experience"", ""pricing""]","{""internet_speed"": ""positive"", ""5g_experience"": ""positive"", ""pricing"": ""positive""}",app_review
1010,Horrible network coverage on highways between the two cities. My call dropped 5 times during a 2 hour drive yesterday. This is unacceptable for people who commute daily. I need a reliable connection for work calls and this network simply cannot deliver that basic requirement on major roads.,"[""network_coverage"", ""call_quality""]","{""network_coverage"": ""negative"", ""call_quality"": ""negative""}",complaint_ticket
1011,Worst call quality ever. Been with this network 3 years and it is getting worse not better.,"[""call_quality""]","{""call_quality"": ""negative""}",twitter
1012,Network coverage is okay across most areas I travel to for work. It functions well enough in the city and on main highways but there are definitely dead spots once you move into smaller residential lanes. Nothing exceptional but also nothing terrible. Just average middle of the road service that gets the basic job done.,"[""network_coverage""]","{""network_coverage"": ""neutral""}",app_review
1013,5G is available in my area now and the speeds are insane. Video calls are super smooth and there's no buffering at all even during peak evening hours. Really impressed with how far the technology has come.,"[""5g_experience"", ""call_quality"", ""internet_speed""]","{""5g_experience"": ""positive"", ""call_quality"": ""positive"", ""internet_speed"": ""positive""}",customer_care_chat
1014,The custmer support team was very rude when I called about my network issues. No resolution provided.,"[""customer_support"", ""network_coverage""]","{""customer_support"": ""negative"", ""network_coverage"": ""negative""}",complaint_ticket
1015,Call quality is about the same after the tower work in our area. No change.,"[""call_quality""]","{""call_quality"": ""neutral""}",survey
1016,cant blv how bad the coverage is in my area. paying premium price for this?? not acceptable,"[""network_coverage"", ""pricing""]","{""network_coverage"": ""negative"", ""pricing"": ""negative""}",twitter
1017,Average 5G experience. Speeds fluctuate a lot depending on the time of day.,"[""5g_experience""]","{""5g_experience"": ""neutral""}",app_review
1018,I've been using this network for over a year now and the call quality in my neighborhood has always been excellent. Never experienced a dropped call or static noise. The network coverage extends well into the basement parking area too which is rare.,"[""call_quality"", ""network_coverage""]","{""call_quality"": ""positive"", ""network_coverage"": ""positive""}",survey
1019,Recharge plans are overpriced for the network quality we actually receive. Calls drop frequently in tier 2 cities which makes the premium pricing completely unjustified. I have tried multiple plans hoping for better service but the underlying network infrastructure clearly needs major upgrades before they can charge these rates.,"[""recharge_plans"", ""network_coverage"", ""call_quality""]","{""recharge_plans"": ""negative"", ""network_coverage"": ""negative"", ""call_quality"": ""negative""}",complaint_ticket
1020,"5G rollout is ok I guess. Not everywhere yet but where it works, it works well.","[""5g_experience""]","{""5g_experience"": ""neutral""}",customer_care_chat
1021,Network coverage in my new city is average overall. It works fine in commercial areas and main roads but struggles in some older residential buildings. The signal fluctuates between full bars and two bars depending on where exactly I am. Not a deal breaker but not impressive either for the rates they charge.,"[""network_coverage""]","{""network_coverage"": ""neutral""}",app_review
1022,prblm with call quality since last week. voice keeps echoing and breaking. plz fix asap,"[""call_quality""]","{""call_quality"": ""negative""}",customer_care_chat
1023,"The 5G experience is transformative for my work from home setup. Video conferences are lag-free, downloads are instant, and the connection is rock solid throughout the day. Worth every penny of the premium plan.","[""5g_experience"", ""internet_speed"", ""value_for_money""]","{""5g_experience"": ""positive"", ""internet_speed"": ""positive"", ""value_for_money"": ""positive""}",app_review
1024,Network coverage is satisfactory in my daily use areas. I do not have major complaints but I also would not say it exceeds expectations. The coverage works for basic calls and messaging without frequent drops. In indoor areas it can get slightly weak but manageable. Overall a neutral average experience.,"[""network_coverage""]","{""network_coverage"": ""neutral""}",survey
1025,I travel a lot for work and the roaming experience is seamless. Call quality remains consistent whether I'm in metro cities or smaller towns. Very reliable network overall.,"[""roaming"", ""call_quality"", ""network_coverage""]","{""roaming"": ""positive"", ""call_quality"": ""positive"", ""network_coverage"": ""positive""}",survey
1026,Your 5G is a joke. Same speed as 4G in most places. Stop false advertising.,"[""5g_experience""]","{""5g_experience"": ""negative""}",twitter
1027,Excellent call clarity. No issues with network coverage either. Solid carrier.,"[""call_quality"", ""network_coverage""]","{""call_quality"": ""positive"", ""network_coverage"": ""positive""}",app_review
1028,The mobile app crashes every time I try to check my data balance. Meanwhile call quality has gone downhill since I moved to this area. The app needs a serious overhaul and so does the tower infrastructure here.,"[""mobile_app_experience"", ""data_balance"", ""call_quality"", ""network_coverage""]","{""mobile_app_experience"": ""negative"", ""data_balance"": ""negative"", ""call_quality"": ""negative"", ""network_coverage"": ""negative""}",app_review
1029,5G signal is present at my home. Not sure it makes a huge difference yet.,"[""5g_experience""]","{""5g_experience"": ""neutral""}",customer_care_chat
1030,reacharg plans r too costly for the network we get. custmer care doesnt help either,"[""recharge_plans"", ""network_coverage"", ""customer_support""]","{""recharge_plans"": ""negative"", ""network_coverage"": ""negative"", ""customer_support"": ""negative""}",complaint_ticket
1031,Inconsistent network coverage on my daily commute. Calls drop twice a day on the metro.,"[""network_coverage"", ""call_quality""]","{""network_coverage"": ""negative"", ""call_quality"": ""negative""}",survey
1032,Tried the 5G plan for a month. Speeds are good but not life-changing compared to 4G in my area. The coverage map they showed was accurate at least.,"[""5g_experience"", ""network_coverage""]","{""5g_experience"": ""neutral"", ""network_coverage"": ""positive""}",app_review
1033,Terrible call quality in basement areas and underground parking. I expected better from a premium carrier that charges top dollar for their plans. Every time I go below ground level the calls become completely unusable with heavy static and frequent disconnections. This is a basic infrastructure issue they need to address.,"[""call_quality""]","{""call_quality"": ""negative""}",complaint_ticket
1034,I recently activated my SIM and the whole process was smooth. The network coverage where I live is excellent and 5G works right out of the box. Really happy with my choice of carrier.,"[""sim_activation"", ""network_coverage"", ""5g_experience""]","{""sim_activation"": ""positive"", ""network_coverage"": ""positive"", ""5g_experience"": ""positive""}",app_review
1035,Network works fine. Call quality is acceptable.,"[""network_coverage"", ""call_quality""]","{""network_coverage"": ""neutral"", ""call_quality"": ""neutral""}",survey
1036,tbh ok network but the 5g is not what they promised. expected much better speeds for the price,"[""network_coverage"", ""5g_experience"", ""pricing""]","{""network_coverage"": ""neutral"", ""5g_experience"": ""negative"", ""pricing"": ""negative""}",twitter
1037,"Best call quality I've experienced on any network. Zero static, zero drops.","[""call_quality""]","{""call_quality"": ""positive""}",app_review
1038,The network coverage in the new industrial zone is completely non-existent. Multiple colleagues on the same network face the exact same issue every single day. We have raised several tickets over the past two months but received no resolution or even a timeline for when this might be fixed. Very disappointing service for business users who depend on connectivity.,"[""network_coverage"", ""customer_support""]","{""network_coverage"": ""negative"", ""customer_support"": ""negative""}",complaint_ticket
1039,5G speeds are there but nothing mind-blowing. Acceptable I guess.,"[""5g_experience""]","{""5g_experience"": ""neutral""}",twitter
1040,my intrenet keeps disconnecting in the evening. call quality also bad during peak hours. worst service provider honestly,"[""internet_speed"", ""call_quality""]","{""internet_speed"": ""negative"", ""call_quality"": ""negative""}",complaint_ticket
1041,Network coverage throughout my apartment complex is acceptable but not outstanding. It works on most floors without issues but the signal gets weak in the parking basement and some corners of the gym area. For everyday usage like calls and messaging it is fine. Would appreciate stronger indoor coverage though.,"[""network_coverage""]","{""network_coverage"": ""neutral""}",survey
1042,The OTT bundle with the 5G plan is a great value add. Netflix and Prime included with excellent streaming quality thanks to the fast network. Only concern is the data validity period could be longer for the price.,"[""ott_bundle_services"", ""5g_experience"", ""internet_speed"", ""data_validity"", ""pricing""]","{""ott_bundle_services"": ""positive"", ""5g_experience"": ""positive"", ""internet_speed"": ""positive"", ""data_validity"": ""negative"", ""pricing"": ""negative""}",app_review
1043,Call quality is mediocre at best on this network. It is neither impressively good nor terribly bad. Conversations are understandable but there is often a slight background hiss and occasional brief audio gaps. For casual calls it is fine but for professional or long duration calls the inconsistency becomes noticeable over time.,"[""call_quality""]","{""call_quality"": ""neutral""}",survey
1044,plz improve coverage in my area. been 6 months no improvement. calls drop daily,"[""network_coverage"", ""call_quality""]","{""network_coverage"": ""negative"", ""call_quality"": ""negative""}",customer_care_chat
1045,Solid 5G performance for gaming. Low latency and high speeds consistently.,"[""5g_experience"", ""internet_speed""]","{""5g_experience"": ""positive"", ""internet_speed"": ""positive""}",app_review
1046,Moved to a new area last month and the network coverage here is absolutely abysmal. I work from home and need stable connectivity for client calls throughout the day. Had to switch to Wi-Fi calling because the native call quality is completely unusable with constant drops and distortion. Seriously considering switching carriers at this point.,"[""network_coverage"", ""call_quality""]","{""network_coverage"": ""negative"", ""call_quality"": ""negative""}",complaint_ticket
1047,Great value for money with the new 5G plan. Coverage and call quality are top notch.,"[""value_for_money"", ""5g_experience"", ""network_coverage"", ""call_quality""]","{""value_for_money"": ""positive"", ""5g_experience"": ""positive"", ""network_coverage"": ""positive"", ""call_quality"": ""positive""}",survey
1048,5G coverage map says available but I never get 5G signal at home. Misleading.,"[""5g_experience"", ""network_coverage""]","{""5g_experience"": ""negative"", ""network_coverage"": ""negative""}",twitter
1049,The network has been unstable for months. Frequent call drops and poor coverage in my locality. Not what I signed up for.,"[""network_coverage"", ""call_quality""]","{""network_coverage"": ""negative"", ""call_quality"": ""negative""}",survey
1050,Your customer support is terrible. Waited 45 minutes to report a network issue. Still not fixed.,"[""customer_support"", ""network_coverage""]","{""customer_support"": ""negative"", ""network_coverage"": ""negative""}",twitter
1051,5G in the business district is average. Works for basic tasks.,"[""5g_experience""]","{""5g_experience"": ""neutral""}",app_review
1052,I bought this plan specifically for the 5G experience but I'm stuck on 4G most of the time. The coverage is very patchy and inconsistent. When it does connect to 5G the speeds are good but that happens maybe 30% of the time.,"[""5g_experience"", ""network_coverage"", ""internet_speed""]","{""5g_experience"": ""negative"", ""network_coverage"": ""negative"", ""internet_speed"": ""positive""}",complaint_ticket
1053,Decent coverage. Calls are clear most of the time.,"[""network_coverage"", ""call_quality""]","{""network_coverage"": ""neutral"", ""call_quality"": ""positive""}",customer_care_chat
1054,The 5G upgrade was genuinely worth it. Streaming and calls both improved significantly since switching.,"[""5g_experience"", ""internet_speed"", ""call_quality""]","{""5g_experience"": ""positive"", ""internet_speed"": ""positive"", ""call_quality"": ""positive""}",twitter
1055,No 5G in my area yet. Waiting for rollout.,"[""5g_experience""]","{""5g_experience"": ""neutral""}",customer_care_chat
1056,The billing is transparent and the network coverage has been great since I joined. Call quality is consistently good across different locations in my city. Really appreciate the honest service.,"[""billing"", ""network_coverage"", ""call_quality""]","{""billing"": ""positive"", ""network_coverage"": ""positive"", ""call_quality"": ""positive""}",app_review
1057,Coverage is there in most places but call quality keeps fluctuating quite a bit during rainy weather. When it rains heavily the voice calls become distorted with crackling sounds and occasional drops. On clear days everything works fine. This seasonal inconsistency is annoying especially during monsoon months when it rains almost daily.,"[""network_coverage"", ""call_quality""]","{""network_coverage"": ""neutral"", ""call_quality"": ""negative""}",survey
1058,v bad network in my office area. been complaining for months with no fix. very frustrting,"[""network_coverage""]","{""network_coverage"": ""negative""}",complaint_ticket
1059,Happy with 5G performance. Meets my expectations for the price I pay.,"[""5g_experience"", ""value_for_money""]","{""5g_experience"": ""positive"", ""value_for_money"": ""positive""}",survey
1060,Network drops in the elevator but works fine everywhere else in the building. Call quality on the terrace is excellent though. I'd rate the overall experience as good with minor inconveniences that I can live with.,"[""network_coverage"", ""call_quality""]","{""network_coverage"": ""neutral"", ""call_quality"": ""positive""}",app_review
1061,Switched from competitor. Coverage here is about the same honestly.,"[""network_coverage""]","{""network_coverage"": ""neutral""}",twitter
1062,the 5g prblm in my area is ridiculous. tower was supposed to be installed last month. still waiting for proper coverage and decent call quality,"[""5g_experience"", ""network_coverage"", ""call_quality""]","{""5g_experience"": ""negative"", ""network_coverage"": ""negative"", ""call_quality"": ""negative""}",complaint_ticket
1063,5G finally launched here but it keeps dropping back to 4G. Disappointing rollout.,"[""5g_experience""]","{""5g_experience"": ""negative""}",app_review
1064,I have had consistent network coverage issues for the past three months in my residential colony. Multiple neighbors on the same network confirm they face identical problems. We have collectively written to the company twice but the only response has been generic auto-replies with no real action taken. The coverage was fine a year ago so something has clearly changed with the infrastructure.,"[""network_coverage"", ""customer_support""]","{""network_coverage"": ""negative"", ""customer_support"": ""negative""}",complaint_ticket
1065,Call quality is neither good nor bad. Average experience overall.,"[""call_quality""]","{""call_quality"": ""neutral""}",survey
1066,The 5G coverage in airports and malls is impressive. I can make HD video calls without any lag and the browsing experience is seamless. However the pricing for the 5G tier feels steep compared to what competitors offer.,"[""5g_experience"", ""network_coverage"", ""call_quality"", ""pricing""]","{""5g_experience"": ""positive"", ""network_coverage"": ""positive"", ""call_quality"": ""positive"", ""pricing"": ""negative""}",app_review
1067,Network is average and gets the job done for basic everyday calls and light browsing. I have not experienced complete outages but the speeds are never fast enough for smooth video calls or heavy streaming. For the price I pay it feels like just barely acceptable service. Nothing that makes me want to stay or switch.,"[""network_coverage"", ""call_quality""]","{""network_coverage"": ""neutral"", ""call_quality"": ""neutral""}",survey
1068,omg the call quality is so bad today. cant hear anything properly. fix ur towers plz,"[""call_quality"", ""network_coverage""]","{""call_quality"": ""negative"", ""network_coverage"": ""negative""}",twitter
1069,Impressed with the 5G trial. Speed test showed 1.2 Gbps download.,"[""5g_experience"", ""internet_speed""]","{""5g_experience"": ""positive"", ""internet_speed"": ""positive""}",app_review
1070,I want to appreciate the significant network improvements in my locality over the past six months. Earlier the coverage was extremely spotty and calls would frequently drop mid-conversation which was very embarrassing during work calls. After they installed a new tower last quarter everything has improved dramatically. Calls are crystal clear now and I rarely see signal drops even indoors.,"[""network_coverage"", ""call_quality""]","{""network_coverage"": ""positive"", ""call_quality"": ""positive""}",customer_care_chat
1071,5G is not available in most places they claim. Overhyped.,"[""5g_experience""]","{""5g_experience"": ""negative""}",twitter
1072,the reacharg plan i took has poor data validity and the network coverage in my area is below average. not getting value for the money spent at all,"[""recharge_plans"", ""data_validity"", ""network_coverage"", ""value_for_money""]","{""recharge_plans"": ""negative"", ""data_validity"": ""negative"", ""network_coverage"": ""negative"", ""value_for_money"": ""negative""}",complaint_ticket
1073,Signal is present in the city center. Nothing remarkable.,"[""network_coverage""]","{""network_coverage"": ""neutral""}",survey
1074,I'm on the 5G plan and honestly it has been a mixed bag. Some days the speed is incredible and other days it reverts to 4G without warning. The coverage map needs to be more accurate. At least call quality hasn't suffered.,"[""5g_experience"", ""network_coverage"", ""call_quality""]","{""5g_experience"": ""neutral"", ""network_coverage"": ""negative"", ""call_quality"": ""positive""}",app_review
1075,Pathetic network service in my apartment building. There is absolutely no coverage inside any of the units. I have to go to the balcony or step outside just to make a phone call. Multiple residents have complained but nothing has changed. For what we pay monthly this level of service is completely unacceptable.,"[""network_coverage""]","{""network_coverage"": ""negative""}",complaint_ticket
1076,cant blv they charge so much and the 5g doesnt even work properly in most areas. total waste of money,"[""5g_experience"", ""pricing"", ""value_for_money""]","{""5g_experience"": ""negative"", ""pricing"": ""negative"", ""value_for_money"": ""negative""}",twitter
1077,Call quality for business use is terrible. Network cuts out during video conferences regularly.,"[""call_quality"", ""network_coverage""]","{""call_quality"": ""negative"", ""network_coverage"": ""negative""}",survey
1078,Recently moved to a tier 2 city and was pleasantly surprised by the 5G availability here. The tower density seems good as I get consistent signal strength at home and office. Internet speeds hover around 500 Mbps which is more than enough for my needs.,"[""5g_experience"", ""network_coverage"", ""internet_speed""]","{""5g_experience"": ""positive"", ""network_coverage"": ""positive"", ""internet_speed"": ""positive""}",app_review
1079,5G experience is just okay after using it for a couple of months now. It is not the revolution they promised in their advertising campaigns. Speeds are marginally better than 4G in my area and the coverage is still patchy. I expected a much bigger leap in performance based on all the marketing and premium pricing.,"[""5g_experience""]","{""5g_experience"": ""neutral""}",survey
1080,plz look into network prblm in sector 45. calling is impossible after 8pm. v bad service,"[""network_coverage"", ""call_quality""]","{""network_coverage"": ""negative"", ""call_quality"": ""negative""}",customer_care_chat
1081,Smooth 5G experience on my new phone. Very fast downloads.,"[""5g_experience"", ""internet_speed""]","{""5g_experience"": ""positive"", ""internet_speed"": ""positive""}",app_review
1082,The network coverage is wide but the call quality doesn't match. I get full signal bars but voice calls still have a slight delay which is annoying during professional conversations. The 5G data speeds are good though so I use VoIP instead.,"[""network_coverage"", ""call_quality"", ""5g_experience""]","{""network_coverage"": ""positive"", ""call_quality"": ""negative"", ""5g_experience"": ""positive""}",complaint_ticket
1083,Coverage is poor for my daily needs. Calls drop frequently even indoors.,"[""network_coverage"", ""call_quality""]","{""network_coverage"": ""negative"", ""call_quality"": ""negative""}",customer_care_chat
1084,The 5G in this city is amazing. Never going back to my old provider. Speeds are unreal.,"[""5g_experience"", ""internet_speed""]","{""5g_experience"": ""positive"", ""internet_speed"": ""positive""}",twitter
1085,Call quality during international calls is consistently poor with lots of echo and delay. I make regular calls to family abroad and every single conversation is plagued by voice distortion and awkward pauses from the latency. This was not an issue with my previous carrier so it is clearly a network routing problem that needs to be addressed.,"[""call_quality""]","{""call_quality"": ""negative""}",complaint_ticket
1086,Have been using the 5G service for two months now. Network coverage inside buildings could be better but outdoor reception is strong. The app makes it easy to track my data consumption and the recharge process is seamless.,"[""5g_experience"", ""network_coverage"", ""mobile_app_experience"", ""recharge_plans""]","{""5g_experience"": ""positive"", ""network_coverage"": ""neutral"", ""mobile_app_experience"": ""positive"", ""recharge_plans"": ""positive""}",app_review
1087,Network coverage seems the same as before. No noticeable change this quarter.,"[""network_coverage""]","{""network_coverage"": ""neutral""}",survey
