id,feedback,aspects,aspect_sentiments,source_channel
1533,The OTT bundle only gives mobile-only plans which means I cannot cast content to my television. For a family recharge plan costing 799 rupees this limitation is unacceptable. Other carriers at the same price point include full screen access. Very poor value for money.,"[""ott_bundle_services"", ""recharge_plans"", ""value_for_money"", ""pricing""]","{""ott_bundle_services"": ""negative"", ""recharge_plans"": ""negative"", ""value_for_money"": ""negative"", ""pricing"": ""negative""}",complaint_ticket
1534,Recharge options are okay. Satisfactory for average users.,"[""recharge_plans""]","{""recharge_plans"": ""neutral""}",survey
1535,plz add jio cinema to the ott bundle. everyone has it except u guys. the current bundle feels incomplete without a sports streaming option. would make the plan much better value,"[""ott_bundle_services"", ""recharge_plans"", ""value_for_money""]","{""ott_bundle_services"": ""negative"", ""recharge_plans"": ""negative"", ""value_for_money"": ""negative""}",customer_care_chat
1536,I appreciate that the recharge plans clearly state which OTT services are included before purchase. The app shows a comparison view that makes it easy to decide. Value for money improves significantly on the quarterly plans compared to monthly ones. Smart to commit longer.,"[""recharge_plans"", ""ott_bundle_services"", ""mobile_app_experience"", ""value_for_money""]","{""recharge_plans"": ""positive"", ""ott_bundle_services"": ""positive"", ""mobile_app_experience"": ""positive"", ""value_for_money"": ""positive""}",app_review
1537,Value for money on budget plans is poor. Barely any benefits.,"[""value_for_money"", ""recharge_plans""]","{""value_for_money"": ""negative"", ""recharge_plans"": ""negative""}",complaint_ticket
1538,ngl disappointed that they removed the music streaming app from the ott bundle. was one of the main reasons i stayed. now just video apps remain which i barely use. lost a loyal custmer soon,"[""ott_bundle_services""]","{""ott_bundle_services"": ""negative""}",twitter
1539,Recharge plan with OTT is good value. Renewed happily this quarter.,"[""recharge_plans"", ""ott_bundle_services"", ""value_for_money""]","{""recharge_plans"": ""positive"", ""ott_bundle_services"": ""positive"", ""value_for_money"": ""positive""}",customer_care_chat
1540,The OTT bundle login process is cumbersome and breaks frequently. Every time my recharge renews I have to re-authenticate on all streaming apps manually. This should be automatic and seamless. The value is there but the user experience around activating it needs serious work.,"[""ott_bundle_services"", ""mobile_app_experience""]","{""ott_bundle_services"": ""negative"", ""mobile_app_experience"": ""negative""}",app_review
1541,Average value for money. Plans sit in line with market norms.,"[""value_for_money""]","{""value_for_money"": ""neutral""}",survey
1542,intrenet speed is great and the ott bundle makes the plan worth every rupee. streaming in hd without any buffering even during peak hours. best reacharg plan i have used from any carrier honestly,"[""internet_speed"", ""ott_bundle_services"", ""recharge_plans"", ""value_for_money""]","{""internet_speed"": ""positive"", ""ott_bundle_services"": ""positive"", ""recharge_plans"": ""positive"", ""value_for_money"": ""positive""}",app_review
1543,OTT content quality in the bundle is basic tier. Not premium access.,"[""ott_bundle_services""]","{""ott_bundle_services"": ""negative""}",survey
1544,The recharge plans need a revamp. The current structure is outdated and does not reflect how people actually consume content and data today. Most users want high data limits with good OTT access rather than unlimited calls which are barely used anymore.,"[""recharge_plans"", ""ott_bundle_services""]","{""recharge_plans"": ""negative"", ""ott_bundle_services"": ""negative""}",survey
1545,Value for money with bundled OTT is average. Standard market offering.,"[""value_for_money"", ""ott_bundle_services""]","{""value_for_money"": ""neutral"", ""ott_bundle_services"": ""neutral""}",app_review
1546,ur ott bundle is basically useless. gives mobile only plans that r unwatchable on anything bigger than a phone screen. for 599 plan at least give us proper tv access. other carriers do,"[""ott_bundle_services"", ""recharge_plans"", ""value_for_money""]","{""ott_bundle_services"": ""negative"", ""recharge_plans"": ""negative"", ""value_for_money"": ""negative""}",complaint_ticket
1547,The value for money analysis clearly favors the 84-day plans over monthly ones. When you break it down per day the longer validity plans include better OTT bundles and more daily data at a lower effective cost. I always advise friends to go for quarterly minimum.,"[""value_for_money"", ""recharge_plans"", ""data_validity"", ""ott_bundle_services""]","{""value_for_money"": ""positive"", ""recharge_plans"": ""positive"", ""data_validity"": ""positive"", ""ott_bundle_services"": ""positive""}",survey
1548,Recharge plan is adequate for basic usage. Standard offering.,"[""recharge_plans""]","{""recharge_plans"": ""neutral""}",customer_care_chat
1549,tbh the value for money depends on which plan you pick. lower plans have zero ott and poor data. but the 599 and above are genuinely competitive with good streaming access and enough data,"[""value_for_money"", ""recharge_plans"", ""ott_bundle_services""]","{""value_for_money"": ""neutral"", ""recharge_plans"": ""neutral"", ""ott_bundle_services"": ""neutral""}",twitter
1550,Switched to this carrier for the OTT bundles and the overall value for money is impressive. My previous carrier charged similar rates but included nothing beyond basic data and calls. Here I get Netflix and Prime at no extra cost which completely justifies the monthly spend.,"[""ott_bundle_services"", ""value_for_money"", ""recharge_plans""]","{""ott_bundle_services"": ""positive"", ""value_for_money"": ""positive"", ""recharge_plans"": ""positive""}",app_review
1551,OTT bundle variety is limited compared to competitors.,"[""ott_bundle_services""]","{""ott_bundle_services"": ""negative""}",survey
1552,The recharge plan comparison feature in the app is helpful for identifying the best value option. I can filter by OTT bundles included and sort by price per day. This kind of tool empowers customers to make informed choices rather than defaulting to whatever is promoted.,"[""recharge_plans"", ""mobile_app_experience"", ""ott_bundle_services"", ""value_for_money""]","{""recharge_plans"": ""positive"", ""mobile_app_experience"": ""positive"", ""ott_bundle_services"": ""positive"", ""value_for_money"": ""positive""}",app_review
1553,Value for money is neutral on this carrier. Neither great nor terrible.,"[""value_for_money""]","{""value_for_money"": ""neutral""}",survey
1554,prblm with ott bundle is the quality. netflix only gives 480p mobile plan which looks terrible even on a large phone screen. for a plan costing 499 they should at least give hd access. not value for money at all,"[""ott_bundle_services"", ""recharge_plans"", ""value_for_money""]","{""ott_bundle_services"": ""negative"", ""recharge_plans"": ""negative"", ""value_for_money"": ""negative""}",complaint_ticket
1555,Recharge plan I chose is adequate. Gets the job done.,"[""recharge_plans""]","{""recharge_plans"": ""neutral""}",customer_care_chat
1556,The OTT bundle adds genuine value to an already competitive recharge plan. I was subscribing to three streaming services independently before and now they are all covered under my mobile plan. The savings are real and the convenience of single billing makes life simpler.,"[""ott_bundle_services"", ""recharge_plans"", ""value_for_money"", ""billing""]","{""ott_bundle_services"": ""positive"", ""recharge_plans"": ""positive"", ""value_for_money"": ""positive"", ""billing"": ""positive""}",survey
1557,Recharge plan validity is too short for the price. Bad deal overall.,"[""recharge_plans"", ""data_validity"", ""value_for_money""]","{""recharge_plans"": ""negative"", ""data_validity"": ""negative"", ""value_for_money"": ""negative""}",complaint_ticket
1558,cant blv they call this value for money. 399 plan gives 1.5gb data and the ott bundle only has one app. competitors give 2gb plus 3 apps at same price. switching next month for sure,"[""value_for_money"", ""recharge_plans"", ""ott_bundle_services""]","{""value_for_money"": ""negative"", ""recharge_plans"": ""negative"", ""ott_bundle_services"": ""negative""}",twitter
1559,OTT bundle included in my plan is standard. Covers basic streaming.,"[""ott_bundle_services"", ""recharge_plans""]","{""ott_bundle_services"": ""neutral"", ""recharge_plans"": ""neutral""}",app_review
1560,I specifically chose this carrier because of the included OTT services and I must say the integration is seamless. One-tap activation from the telecom app opens Netflix directly with my credentials already populated. This frictionless experience adds genuine value beyond just the content itself.,"[""ott_bundle_services"", ""mobile_app_experience"", ""value_for_money""]","{""ott_bundle_services"": ""positive"", ""mobile_app_experience"": ""positive"", ""value_for_money"": ""positive""}",app_review
1561,Recharge plans are standard. Nothing stands out positively or negatively.,"[""recharge_plans""]","{""recharge_plans"": ""neutral""}",survey
1562,plz bring back the old 499 plan with full ott access. the new plan at same price has fewer benefits and shorter validity. loyal custmers are being punished for staying. where is the value,"[""recharge_plans"", ""ott_bundle_services"", ""value_for_money"", ""data_validity""]","{""recharge_plans"": ""negative"", ""ott_bundle_services"": ""negative"", ""value_for_money"": ""negative"", ""data_validity"": ""negative""}",customer_care_chat
1563,The value for money on premium plans is genuinely excellent. The 999 monthly plan gives unlimited 5G data with full OTT access including premium tiers of Netflix and Prime. Call quality and network coverage are both superb at this tier. Worth every rupee for heavy users.,"[""value_for_money"", ""recharge_plans"", ""5g_experience"", ""ott_bundle_services"", ""call_quality"", ""network_coverage""]","{""value_for_money"": ""positive"", ""recharge_plans"": ""positive"", ""5g_experience"": ""positive"", ""ott_bundle_services"": ""positive"", ""call_quality"": ""positive"", ""network_coverage"": ""positive""}",survey
1564,OTT bundle is standard. Same as what everyone offers now.,"[""ott_bundle_services""]","{""ott_bundle_services"": ""neutral""}",survey
1565,ngl the recharge plans have gotten worse since last year. they keep cutting benefits while prices stay same or go up. ott bundle is smaller now too. losing the value for money edge they had,"[""recharge_plans"", ""pricing"", ""ott_bundle_services"", ""value_for_money""]","{""recharge_plans"": ""negative"", ""pricing"": ""negative"", ""ott_bundle_services"": ""negative"", ""value_for_money"": ""negative""}",twitter
1566,Value for money is acceptable. OTT access is standard for this price range.,"[""value_for_money"", ""ott_bundle_services""]","{""value_for_money"": ""neutral"", ""ott_bundle_services"": ""neutral""}",customer_care_chat
1567,My family of four uses the shared plan which includes separate OTT profiles for each member. The value for money is remarkable because individually these subscriptions would cost us triple. Data allocation is generous and the billing is consolidated and clear.,"[""recharge_plans"", ""ott_bundle_services"", ""value_for_money"", ""billing""]","{""recharge_plans"": ""positive"", ""ott_bundle_services"": ""positive"", ""value_for_money"": ""positive"", ""billing"": ""positive""}",app_review
1568,OTT access keeps logging me out. Very annoying bug in the system.,"[""ott_bundle_services""]","{""ott_bundle_services"": ""negative""}",complaint_ticket
1569,The recharge plan pricing is transparent and I always know what I am getting before I pay. The included OTT services are clearly listed and the data validity is prominently displayed. No hidden conditions or asterisks. This straightforward approach builds customer trust.,"[""recharge_plans"", ""pricing"", ""ott_bundle_services"", ""data_validity""]","{""recharge_plans"": ""positive"", ""pricing"": ""positive"", ""ott_bundle_services"": ""positive"", ""data_validity"": ""positive""}",survey
1570,Value for money is debatable. Depends on how much OTT you use.,"[""value_for_money"", ""ott_bundle_services""]","{""value_for_money"": ""neutral"", ""ott_bundle_services"": ""neutral""}",survey
1571,intrenet speed is too slow to actually stream anything from the ott bundle properly. whats the point of including netflix if the data speed cant handle even standard definition. false advertising on the reacharg plan,"[""internet_speed"", ""ott_bundle_services"", ""recharge_plans""]","{""internet_speed"": ""negative"", ""ott_bundle_services"": ""negative"", ""recharge_plans"": ""negative""}",complaint_ticket
1572,Recharge plan is reasonably priced. Standard market offering.,"[""recharge_plans"", ""pricing""]","{""recharge_plans"": ""neutral"", ""pricing"": ""neutral""}",app_review
1573,The OTT bundle on the quarterly plan is the best in the market right now. Five major streaming platforms included with HD quality access. Combined with 2.5GB daily data and strong network coverage this plan delivers exceptional value that justifies the 899 rupee price tag.,"[""ott_bundle_services"", ""recharge_plans"", ""internet_speed"", ""network_coverage"", ""value_for_money""]","{""ott_bundle_services"": ""positive"", ""recharge_plans"": ""positive"", ""internet_speed"": ""positive"", ""network_coverage"": ""positive"", ""value_for_money"": ""positive""}",app_review
1574,Average recharge plan. OTT bundle is basic but functional.,"[""recharge_plans"", ""ott_bundle_services""]","{""recharge_plans"": ""neutral"", ""ott_bundle_services"": ""neutral""}",survey
1575,omg cant blv how bad the value for money has become. same plan that was 299 last year is now 349 with fewer ott apps and less data. they think we wont notice but we do. terrible strategy,"[""value_for_money"", ""pricing"", ""ott_bundle_services"", ""recharge_plans""]","{""value_for_money"": ""negative"", ""pricing"": ""negative"", ""ott_bundle_services"": ""negative"", ""recharge_plans"": ""negative""}",twitter
1576,OTT content variety in the premium plan is adequate. Covers major apps.,"[""ott_bundle_services"", ""recharge_plans""]","{""ott_bundle_services"": ""neutral"", ""recharge_plans"": ""neutral""}",survey
1577,Recharge plans need more flexibility. One size does not fit all users and the current rigid tier structure forces people to pay for features they do not need. I want high data but no OTT bundle yet there is no such option. Customizable plans would offer real value.,"[""recharge_plans"", ""ott_bundle_services"", ""value_for_money""]","{""recharge_plans"": ""negative"", ""ott_bundle_services"": ""neutral"", ""value_for_money"": ""negative""}",survey
1578,Value for the price is standard. Streaming services are a basic inclusion now.,"[""value_for_money"", ""ott_bundle_services""]","{""value_for_money"": ""neutral"", ""ott_bundle_services"": ""neutral""}",customer_care_chat
1579,The OTT bundle stopped working after my last recharge even though the plan clearly includes it. Customer support says I need to re-activate manually through the app. Why is this not automatic? The process is unnecessarily complicated and wastes customer time every single cycle.,"[""ott_bundle_services"", ""customer_support"", ""mobile_app_experience""]","{""ott_bundle_services"": ""negative"", ""customer_support"": ""negative"", ""mobile_app_experience"": ""negative""}",complaint_ticket
1580,Decent value for money. Plans are reasonably competitive in the market.,"[""value_for_money"", ""recharge_plans""]","{""value_for_money"": ""neutral"", ""recharge_plans"": ""neutral""}",survey
1581,custmer care helped me find the best value plan with all the ott apps i wanted. she compared three options and explained which one gave the most for my budget. appreciated the honest recommendation,"[""customer_support"", ""value_for_money"", ""ott_bundle_services"", ""recharge_plans""]","{""customer_support"": ""positive"", ""value_for_money"": ""positive"", ""ott_bundle_services"": ""positive"", ""recharge_plans"": ""positive""}",customer_care_chat
1582,OTT bundle is adequate. Has the popular streaming services covered.,"[""ott_bundle_services""]","{""ott_bundle_services"": ""neutral""}",survey
1583,"The value for money proposition completely falls apart on the basic plans below 299. No OTT access, minimal data, short validity. It feels like they deliberately cripple the lower tiers to push people toward expensive plans. Budget users deserve decent value too.","[""value_for_money"", ""ott_bundle_services"", ""recharge_plans"", ""data_validity""]","{""value_for_money"": ""negative"", ""ott_bundle_services"": ""negative"", ""recharge_plans"": ""negative"", ""data_validity"": ""negative""}",complaint_ticket
1584,Good plan with OTT included. Worth the monthly investment.,"[""recharge_plans"", ""ott_bundle_services"", ""value_for_money""]","{""recharge_plans"": ""positive"", ""ott_bundle_services"": ""positive"", ""value_for_money"": ""positive""}",app_review
1585,tbh ok recharge plans. the ott bundle is a nice touch but nothing that makes me feel like im getting an incredible deal. its standard for the industry now so not really a differentiator anymore,"[""recharge_plans"", ""ott_bundle_services"", ""value_for_money""]","{""recharge_plans"": ""neutral"", ""ott_bundle_services"": ""neutral"", ""value_for_money"": ""neutral""}",twitter
1586,"Exceptional value on the annual recharge plan. OTT subscriptions, unlimited data on 5G, and free roaming in select countries all included. When I calculate the per-day cost it comes to less than 10 rupees. This kind of bundling makes it impossible to justify buying anything separately.","[""value_for_money"", ""recharge_plans"", ""ott_bundle_services"", ""5g_experience"", ""roaming""]","{""value_for_money"": ""positive"", ""recharge_plans"": ""positive"", ""ott_bundle_services"": ""positive"", ""5g_experience"": ""positive"", ""roaming"": ""positive""}",app_review
1587,Recharge plan benefits are mediocre at best for the price point.,"[""recharge_plans"", ""pricing""]","{""recharge_plans"": ""negative"", ""pricing"": ""negative""}",complaint_ticket
1588,The OTT bundle integration with the carrier app needs work. Half the time clicking on a streaming service from within the app opens a blank page or throws an error. When it works it is great but the reliability is not where it should be for a core feature.,"[""ott_bundle_services"", ""mobile_app_experience""]","{""ott_bundle_services"": ""negative"", ""mobile_app_experience"": ""negative""}",app_review
1589,Value for money is acceptable on this plan. Standard.,"[""value_for_money""]","{""value_for_money"": ""neutral""}",survey
1590,plz give us the option to choose which ott apps we want in our bundle. i dont use prime but would love youtube premium instead. customizable bundles would be much better value for different types of users,"[""ott_bundle_services"", ""value_for_money"", ""recharge_plans""]","{""ott_bundle_services"": ""negative"", ""value_for_money"": ""negative"", ""recharge_plans"": ""negative""}",customer_care_chat
1591,OTT bundle and data allocation together make this plan worthwhile. I stream daily for at least two hours and still have data remaining at the end of the month. The video quality is consistently good which means the internet speed holds up well even during evening peak hours.,"[""ott_bundle_services"", ""data_balance"", ""internet_speed""]","{""ott_bundle_services"": ""positive"", ""data_balance"": ""positive"", ""internet_speed"": ""positive""}",survey
1592,Recharge plan is overpriced for the OTT quality provided. Not HD.,"[""recharge_plans"", ""ott_bundle_services"", ""pricing""]","{""recharge_plans"": ""negative"", ""ott_bundle_services"": ""negative"", ""pricing"": ""negative""}",complaint_ticket
1593,"The value for money calculation clearly favors this carrier when you include the OTT bundle worth. I was paying 199 for Netflix, 179 for Prime, and 299 for Hotstar separately. Now all three are included in my 799 recharge plan along with 3GB daily data. The math speaks for itself.","[""value_for_money"", ""ott_bundle_services"", ""recharge_plans""]","{""value_for_money"": ""positive"", ""ott_bundle_services"": ""positive"", ""recharge_plans"": ""positive""}",app_review
1594,Standard OTT bundle. Works as advertised nothing more.,"[""ott_bundle_services""]","{""ott_bundle_services"": ""neutral""}",survey
1595,v bad that the ott bundle doesnt carry over if u recharge a day late. missed my renewal by one day and lost all my streaming access. had to reactivate everything manually. punishing custmers for small delays is not ok,"[""ott_bundle_services"", ""recharge_plans""]","{""ott_bundle_services"": ""negative"", ""recharge_plans"": ""negative""}",complaint_ticket
1596,Really good recharge plan with excellent value. The OTT bundle is comprehensive and the data allocation is generous for the price. Combined with reliable network coverage and clear call quality this represents everything I need from a mobile carrier in one package.,"[""recharge_plans"", ""value_for_money"", ""ott_bundle_services"", ""network_coverage"", ""call_quality""]","{""recharge_plans"": ""positive"", ""value_for_money"": ""positive"", ""ott_bundle_services"": ""positive"", ""network_coverage"": ""positive"", ""call_quality"": ""positive""}",survey
1597,OTT benefits are okay. Could include more platforms.,"[""ott_bundle_services""]","{""ott_bundle_services"": ""neutral""}",customer_care_chat
1598,The recharge plan structure is confusing with too many tiers that differ only slightly in OTT access and data limits. They should simplify to three or four clear options. Currently it takes research to figure out which plan gives the best value for money.,"[""recharge_plans"", ""ott_bundle_services"", ""value_for_money""]","{""recharge_plans"": ""negative"", ""ott_bundle_services"": ""negative"", ""value_for_money"": ""negative""}",survey
1599,"Happy with the overall value I receive from this carrier. The combination of fast internet, good OTT access, and competitive pricing makes it easy to stay loyal. The recharge plans keep improving incrementally and the billing is always transparent. Solid carrier.","[""value_for_money"", ""internet_speed"", ""ott_bundle_services"", ""pricing"", ""recharge_plans"", ""billing""]","{""value_for_money"": ""positive"", ""internet_speed"": ""positive"", ""ott_bundle_services"": ""positive"", ""pricing"": ""positive"", ""recharge_plans"": ""positive"", ""billing"": ""positive""}",app_review
1600,"The 5G experience combined with the OTT bundle makes this the most complete recharge plan I have ever used. Internet speed is consistently above 500 Mbps, streaming is buffer-free, and the included Netflix and Prime subscriptions save me over 400 rupees monthly. Exceptional value for money overall.","[""5g_experience"", ""ott_bundle_services"", ""recharge_plans"", ""internet_speed"", ""value_for_money""]","{""5g_experience"": ""positive"", ""ott_bundle_services"": ""positive"", ""recharge_plans"": ""positive"", ""internet_speed"": ""positive"", ""value_for_money"": ""positive""}",app_review
1601,Network coverage is terrible and customer support refuses to acknowledge the problem. Called three times about dropped calls in my area and each time they just say reset your phone. Meanwhile billing keeps charging me full price for a service I can barely use.,"[""network_coverage"", ""customer_support"", ""call_quality"", ""billing""]","{""network_coverage"": ""negative"", ""customer_support"": ""negative"", ""call_quality"": ""negative"", ""billing"": ""negative""}",complaint_ticket
1602,plz fix ur mobile app. cant check data balance or reacharg without it crashing. also the intrenet speed has been terrible since last week in my area,"[""mobile_app_experience"", ""data_balance"", ""recharge_plans"", ""internet_speed""]","{""mobile_app_experience"": ""negative"", ""data_balance"": ""negative"", ""recharge_plans"": ""negative"", ""internet_speed"": ""negative""}",customer_care_chat
1603,SIM activation happened on time. Network started working as expected.,"[""sim_activation"", ""network_coverage""]","{""sim_activation"": ""neutral"", ""network_coverage"": ""neutral""}",survey
1604,Roaming experience in Europe was seamless with good call quality throughout. The data validity on the international pack lasted my entire trip and the pricing was transparent with no hidden charges on the final bill. Very satisfied with every aspect of the service abroad.,"[""roaming"", ""call_quality"", ""data_validity"", ""pricing"", ""billing""]","{""roaming"": ""positive"", ""call_quality"": ""positive"", ""data_validity"": ""positive"", ""pricing"": ""positive"", ""billing"": ""positive""}",survey
1605,Data balance drains too fast. Not matching my actual usage at all.,"[""data_balance""]","{""data_balance"": ""negative""}",complaint_ticket
1606,omg worst custmer support ever. called about sim activation delay and they transferred me 4 times. nobody knows anything. meanwhile my old sim already got deactivated so im without any service,"[""customer_support"", ""sim_activation""]","{""customer_support"": ""negative"", ""sim_activation"": ""negative""}",twitter
